{
  "kind": "ProofReceipt",
  "receipt_id": "proof-receipt-valid-goal5-fixture",
  "task_id": "harness-v2-valid-task",
  "proof_obligation": "compileall exits 0",
  "proof_obligation_sha256": "d2ad6c1f465504fb38bc20f86b803c7662be4263f0556a2dc6169ff7720ce207",
  "verifier": {
    "method": "command",
    "command": "python -m compileall harness_v2",
    "command_sha256": "0bcf3af016adf2ad6b3074f64b48854206d79806770b256508eb917ec70f7a07",
    "ok": true,
    "exit_code": 0,
    "output_sha256": "d2ad6c1f465504fb38bc20f86b803c7662be4263f0556a2dc6169ff7720ce207"
  },
  "source_refs": [
    {
      "path": "CURRENT.md",
      "sha256": "39c24ffa7294815d62487a7bfc5cd7f887f9539690c07022da44b5733caf421b",
      "affects": [
        "proof predicate"
      ]
    },
    {
      "path": "harness_v2\\decisions.py",
      "sha256": "e85c6eec5efc4818445e04e0ec6fa9417ffed16683d600dbe2ff01d980ac770d",
      "affects": [
        "implementation"
      ]
    },
    {
      "path": "tests\\test_harness_v2.py",
      "sha256": "43e90b7d3f94e530d43dc48793e4836941f24674ec991eb13e18baf846c3c5d2",
      "affects": [
        "tests"
      ]
    },
    {
      "path": "tests\\fixtures\\valid-task.json",
      "sha256": "249e2d3c235163b2a8176e436cb06cbcb21a3ee6b606b28b4f27be670412bfb1",
      "affects": [
        "proof command"
      ]
    }
  ],
  "lifecycle_transition": false
}
